{
  "schema_version": "1.0",
  "checkpoint_id": "cp_S3_00042",
  "run_id": "run_1737019200000_a1b2c3d4e5f6",
  "step_id": "S3_extract",
  "tool_id": "extract_entities",
  "tool_contract_version": "1.0",
  "input_snapshot_hash": "sha256:aaaaaaaaaaaaaaaaaaaaaaaaaaaaaaaaaaaaaaaaaaaaaaaaaaaaaaaaaaaaaaaa",
  "boundary": "documents[0:500] committed",
  "resume_token": "document-index:500",
  "completed_units": ["doc-0001", "doc-0500"],
  "state_ref": {
    "path": "S3_extract/Working/checkpoints/cp_S3_00042.json",
    "sha256": "sha256:bbbbbbbbbbbbbbbbbbbbbbbbbbbbbbbbbbbbbbbbbbbbbbbbbbbbbbbbbbbbbbbb",
    "size": 4096
  },
  "created_at": "2026-07-24T10:00:00Z",
  "writer_id": "worker_extract_01"
}
